PMID,Title,Abstract,MH,Test,CleanedText,cluster
31501885,BioBERT: a pre-trained biomedical language representation model for biomedical text mining.,"MOTIVATION: Biomedical text mining is becoming increasingly important as the number of biomedical documents rapidly grows. With the progress in natural language processing (NLP), extracting valuable information from biomedical literature has gained popularity among researchers, and deep learning has boosted the development of effective biomedical text mining models. However, directly applying the advancements in NLP to biomedical text mining often yields unsatisfactory results due to a word distribution shift from general domain corpora to biomedical corpora. In this article, we investigate how the recently introduced pre-trained language model BERT can be adapted for biomedical corpora. RESULTS: We introduce BioBERT (Bidirectional Encoder Representations from Transformers for Biomedical Text Mining), which is a domain-specific language representation model pre-trained on large-scale biomedical corpora. With almost the same architecture across tasks, BioBERT largely outperforms BERT and previous state-of-the-art models in a variety of biomedical text mining tasks when pre-trained on biomedical corpora. While BERT obtains performance comparable to that of previous state-of-the-art models, BioBERT significantly outperforms them on the following three representative biomedical text mining tasks: biomedical named entity recognition (0.62% F1 score improvement), biomedical relation extraction (2.80% F1 score improvement) and biomedical question answering (12.24% MRR improvement). Our analysis results show that pre-training BERT on biomedical corpora helps it to understand complex biomedical texts. AVAILABILITY AND IMPLEMENTATION: We make the pre-trained weights of BioBERT freely available at https://github.com/naver/biobert-pretrained, and the source code for fine-tuning BioBERT available at https://github.com/dmis-lab/biobert.",*Data Mining Language *Natural Language Processing Software,"BioBERT: a pre-trained biomedical language representation model for biomedical text mining. MOTIVATION: Biomedical text mining is becoming increasingly important as the number of biomedical documents rapidly grows. With the progress in natural language processing (NLP), extracting valuable information from biomedical literature has gained popularity among researchers, and deep learning has boosted the development of effective biomedical text mining models. However, directly applying the advancements in NLP to biomedical text mining often yields unsatisfactory results due to a word distribution shift from general domain corpora to biomedical corpora. In this article, we investigate how the recently introduced pre-trained language model BERT can be adapted for biomedical corpora. RESULTS: We introduce BioBERT (Bidirectional Encoder Representations from Transformers for Biomedical Text Mining), which is a domain-specific language representation model pre-trained on large-scale biomedical corpora. With almost the same architecture across tasks, BioBERT largely outperforms BERT and previous state-of-the-art models in a variety of biomedical text mining tasks when pre-trained on biomedical corpora. While BERT obtains performance comparable to that of previous state-of-the-art models, BioBERT significantly outperforms them on the following three representative biomedical text mining tasks: biomedical named entity recognition (0.62% F1 score improvement), biomedical relation extraction (2.80% F1 score improvement) and biomedical question answering (12.24% MRR improvement). Our analysis results show that pre-training BERT on biomedical corpora helps it to understand complex biomedical texts. AVAILABILITY AND IMPLEMENTATION: We make the pre-trained weights of BioBERT freely available at https://github.com/naver/biobert-pretrained, and the source code for fine-tuning BioBERT available at https://github.com/dmis-lab/biobert. *Data Mining Language *Natural Language Processing Software",biomed languag represent model biomed text mine biomed text mine becom increas import number biomed document rapid grow progress natur languag process nlp extract valuabl inform biomed literatur gain popular among research deep learn boost develop effect biomed text mine model howev direct appli advanc nlp biomed text mine often yield unsatisfactori result due word distribut shift general domain corpora biomed corpora articl investig recent introduc languag model bert adapt biomed corpora introduc biobert bidirect encod represent transform biomed text mine languag represent model biomed corpora almost architectur across task biobert larg outperform bert previous model varieti biomed text mine task biomed corpora bert obtain perform compar previous model biobert signific outperform follow three repres biomed text mine biomed name entiti recognit score improv biomed relat extract score improv biomed question answer mrr improv analysi result show bert biomed corpora help understand complex biomed text avail make weight biobert freeli avail github com naver sourc code biobert avail github com biobert mine languag languag process softwar,1
31557052,Generating the Blood Exposome Database Using a Comprehensive Text Mining and Database Fusion Approach.,"BACKGROUND: Blood chemicals are routinely measured in clinical or preclinical research studies to diagnose diseases, assess risks in epidemiological research, or use metabolomic phenotyping in response to treatments. A vast volume of blood-related literature is available via the PubMed database for data mining. OBJECTIVES: We aimed to generate a comprehensive blood exposome database of endogenous and exogenous chemicals associated with the mammalian circulating system through text mining and database fusion. METHODS: Using NCBI resources, we retrieved PubMed abstracts, PubChem chemical synonyms, and PMC supplementary tables. We then employed text mining and PubChem crowdsourcing to associate phrases relating to blood with PubChem chemicals. False positives were removed by a phrase pattern and a compound exclusion list. RESULTS: A query to identify blood-related publications in the PubMed database yielded 1.1 million papers. Matching a total of 15 million synonyms from 6.5 million relevant PubChem chemicals against all blood-related publications yielded 37,514 chemicals and 851,999 publications records. Mapping PubChem compound identifiers to the PubMed database yielded 49,940 unique chemicals linked to 676,643 papers. Analysis of open-access metabolomics papers related to blood phrases in the PMC database yielded 4,039 unique compounds and 204 papers. Consolidating these three approaches summed up to a total of 41,474 achiral structures that were linked to 65,957 PubChem CIDs and to over 878,966 PubMed articles. We mapped these compounds to 50 databases such as those covering metabolites and pathways, governmental and toxicological databases, pharmacology resources, and bioassay repositories. In comparison, HMDB, the Human Metabolome Database, links 1,075 compounds to blood-related primary publications. CONCLUSION: This new Blood Exposome Database can be used for prioritizing chemicals for systematic reviews, developing target assays in exposome research, identifying compounds in untargeted mass spectrometry, and biological interpretation in metabolomics data. The database is available at http://bloodexposome.org. https://doi.org/10.1289/EHP4713.","Biological Assay Data Management *Data Mining *Databases, Factual *Exposome Humans Metabolome Metabolomics PubMed Publications","Generating the Blood Exposome Database Using a Comprehensive Text Mining and Database Fusion Approach. BACKGROUND: Blood chemicals are routinely measured in clinical or preclinical research studies to diagnose diseases, assess risks in epidemiological research, or use metabolomic phenotyping in response to treatments. A vast volume of blood-related literature is available via the PubMed database for data mining. OBJECTIVES: We aimed to generate a comprehensive blood exposome database of endogenous and exogenous chemicals associated with the mammalian circulating system through text mining and database fusion. METHODS: Using NCBI resources, we retrieved PubMed abstracts, PubChem chemical synonyms, and PMC supplementary tables. We then employed text mining and PubChem crowdsourcing to associate phrases relating to blood with PubChem chemicals. False positives were removed by a phrase pattern and a compound exclusion list. RESULTS: A query to identify blood-related publications in the PubMed database yielded 1.1 million papers. Matching a total of 15 million synonyms from 6.5 million relevant PubChem chemicals against all blood-related publications yielded 37,514 chemicals and 851,999 publications records. Mapping PubChem compound identifiers to the PubMed database yielded 49,940 unique chemicals linked to 676,643 papers. Analysis of open-access metabolomics papers related to blood phrases in the PMC database yielded 4,039 unique compounds and 204 papers. Consolidating these three approaches summed up to a total of 41,474 achiral structures that were linked to 65,957 PubChem CIDs and to over 878,966 PubMed articles. We mapped these compounds to 50 databases such as those covering metabolites and pathways, governmental and toxicological databases, pharmacology resources, and bioassay repositories. In comparison, HMDB, the Human Metabolome Database, links 1,075 compounds to blood-related primary publications. CONCLUSION: This new Blood Exposome Database can be used for prioritizing chemicals for systematic reviews, developing target assays in exposome research, identifying compounds in untargeted mass spectrometry, and biological interpretation in metabolomics data. The database is available at http://bloodexposome.org. https://doi.org/10.1289/EHP4713. Biological Assay Data Management *Data Mining *Databases, Factual *Exposome Humans Metabolome Metabolomics PubMed Publications",generat blood exposom databas use comprehens text mine databas fusion approach blood chemic routin measur clinic preclin research studi diagnos diseas assess risk epidemiolog research use metabolom phenotyp respons treatment vast volum literatur avail via pubm databas data mine aim generat comprehens blood exposom databas endogen exogen chemic associ mammalian circul system text mine databas fusion use ncbi resourc retriev pubm abstract pubchem chemic synonym pmc supplementari tabl employ text mine pubchem crowdsourc associ phrase relat blood pubchem chemic fals posit remov phrase pattern compound exclus list queri identifi public pubm databas yield million paper match total million synonym million relev pubchem chemic public yield chemic public record map pubchem compound identifi pubm databas yield uniqu chemic link paper analysi metabolom paper relat blood phrase pmc databas yield uniqu compound paper consolid three approach sum total achir structur link pubchem cid pubm articl map compound databas cover metabolit pathway government toxicolog databas pharmacolog resourc bioassay repositori comparison hmdb human metabolom databas link compound primari public new blood exposom databas use priorit chemic systemat review develop target assay exposom research identifi compound untarget mass spectrometri biolog interpret metabolom data databas avail bloodexposom org doi org biolog assay data manag mine factual human metabolom metabolom pubm public,1
33953899,Text Mining-Based Drug Discovery in Osteoarthritis.,"BACKGROUND: Osteoarthritis (OA) is a chronic and degenerative joint disease, which causes stiffness, pain, and decreased function. At the early stage of OA, nonsteroidal anti-inflammatory drugs (NSAIDs) are considered the first-line treatment. However, the efficacy and utility of available drug therapies are limited. We aim to use bioinformatics to identify potential genes and drugs associated with OA. METHODS: The genes related to OA and NSAIDs therapy were determined by text mining. Then, the common genes were performed for GO, KEGG pathway analysis, and protein-protein interaction (PPI) network analysis. Using the MCODE plugin-obtained hub genes, the expression levels of hub genes were verified using quantitative real-time polymerase chain reaction (qRT-PCR). The confirmed genes were queried in the Drug Gene Interaction Database to determine potential genes and drugs. RESULTS: The qRT-PCR result showed that the expression level of 15 genes was significantly increased in OA samples. Finally, eight potential genes were targetable to a total of 53 drugs, twenty-one of which have been employed to treat OA and 32 drugs have not yet been used in OA. CONCLUSIONS: The 15 genes (including PTGS2, NLRP3, MMP9, IL1RN, CCL2, TNF, IL10, CD40, IL6, NGF, TP53, RELA, BCL2L1, VEGFA, and NOTCH1) and 32 drugs, which have not been used in OA but approved by the FDA for other diseases, could be potential genes and drugs, respectively, to improve OA treatment. Additionally, those methods provided tremendous opportunities to facilitate drug repositioning efforts and study novel target pharmacology in the pharmaceutical industry.",Computational Biology/methods Data Mining Drug Discovery Gene Expression Profiling Humans *Osteoarthritis/drug therapy/genetics/metabolism Protein Interaction Maps/genetics,"Text Mining-Based Drug Discovery in Osteoarthritis. BACKGROUND: Osteoarthritis (OA) is a chronic and degenerative joint disease, which causes stiffness, pain, and decreased function. At the early stage of OA, nonsteroidal anti-inflammatory drugs (NSAIDs) are considered the first-line treatment. However, the efficacy and utility of available drug therapies are limited. We aim to use bioinformatics to identify potential genes and drugs associated with OA. METHODS: The genes related to OA and NSAIDs therapy were determined by text mining. Then, the common genes were performed for GO, KEGG pathway analysis, and protein-protein interaction (PPI) network analysis. Using the MCODE plugin-obtained hub genes, the expression levels of hub genes were verified using quantitative real-time polymerase chain reaction (qRT-PCR). The confirmed genes were queried in the Drug Gene Interaction Database to determine potential genes and drugs. RESULTS: The qRT-PCR result showed that the expression level of 15 genes was significantly increased in OA samples. Finally, eight potential genes were targetable to a total of 53 drugs, twenty-one of which have been employed to treat OA and 32 drugs have not yet been used in OA. CONCLUSIONS: The 15 genes (including PTGS2, NLRP3, MMP9, IL1RN, CCL2, TNF, IL10, CD40, IL6, NGF, TP53, RELA, BCL2L1, VEGFA, and NOTCH1) and 32 drugs, which have not been used in OA but approved by the FDA for other diseases, could be potential genes and drugs, respectively, to improve OA treatment. Additionally, those methods provided tremendous opportunities to facilitate drug repositioning efforts and study novel target pharmacology in the pharmaceutical industry. Computational Biology/methods Data Mining Drug Discovery Gene Expression Profiling Humans *Osteoarthritis/drug therapy/genetics/metabolism Protein Interaction Maps/genetics",text drug discoveri osteoarthr osteoarthr chronic degen joint diseas caus stiff pain decreas function earli stage nonsteroid drug nsaid consid treatment howev efficaci util avail drug therapi limit aim use bioinformat identifi potenti gene drug associ gene relat nsaid therapi determin text mine common gene perform kegg pathway analysi interact ppi network analysi use mcode hub gene express level hub gene verifi use quantit polymeras chain reaction confirm gene queri drug gene interact databas determin potenti gene drug result show express level gene signific increas sampl final eight potenti gene target total drug employ treat drug yet use gene includ tnf ngf rela vegfa drug use approv fda diseas could potenti gene drug respect improv treatment addit method provid tremend opportun facilit drug reposit effort studi novel target pharmacolog pharmaceut industri comput biolog method data mine drug discoveri gene express profil human drug therapi genet metabol protein interact map genet,7
29956014,A Survey of Data Mining and Deep Learning in Bioinformatics.,"The fields of medicine science and health informatics have made great progress recently and have led to in-depth analytics that is demanded by generation, collection and accumulation of massive data. Meanwhile, we are entering a new period where novel technologies are starting to analyze and explore knowledge from tremendous amount of data, bringing limitless potential for information growth. One fact that cannot be ignored is that the techniques of machine learning and deep learning applications play a more significant role in the success of bioinformatics exploration from biological data point of view, and a linkage is emphasized and established to bridge these two data analytics techniques and bioinformatics in both industry and academia. This survey concentrates on the review of recent researches using data mining and deep learning approaches for analyzing the specific domain knowledge of bioinformatics. The authors give a brief but pithy summarization of numerous data mining algorithms used for preprocessing, classification and clustering as well as various optimized neural network architectures in deep learning methods, and their advantages and disadvantages in the practical applications are also discussed and compared in terms of their industrial usage. It is believed that in this review paper, valuable insights are provided for those who are dedicated to start using data analytics methods in bioinformatics.",Algorithms Bayes Theorem *Computational Biology *Data Mining Machine Learning Surveys and Questionnaires,"A Survey of Data Mining and Deep Learning in Bioinformatics. The fields of medicine science and health informatics have made great progress recently and have led to in-depth analytics that is demanded by generation, collection and accumulation of massive data. Meanwhile, we are entering a new period where novel technologies are starting to analyze and explore knowledge from tremendous amount of data, bringing limitless potential for information growth. One fact that cannot be ignored is that the techniques of machine learning and deep learning applications play a more significant role in the success of bioinformatics exploration from biological data point of view, and a linkage is emphasized and established to bridge these two data analytics techniques and bioinformatics in both industry and academia. This survey concentrates on the review of recent researches using data mining and deep learning approaches for analyzing the specific domain knowledge of bioinformatics. The authors give a brief but pithy summarization of numerous data mining algorithms used for preprocessing, classification and clustering as well as various optimized neural network architectures in deep learning methods, and their advantages and disadvantages in the practical applications are also discussed and compared in terms of their industrial usage. It is believed that in this review paper, valuable insights are provided for those who are dedicated to start using data analytics methods in bioinformatics. Algorithms Bayes Theorem *Computational Biology *Data Mining Machine Learning Surveys and Questionnaires",survey data mine deep learn bioinformat field medicin scienc health informat made great progress recent led analyt demand generat collect accumul massiv data meanwhil enter new period novel technolog start analyz explor knowledg tremend amount data bring limitless potenti inform growth one fact cannot ignor techniqu machin learn deep learn applic play signific role success bioinformat explor biolog data point view linkag emphas establish bridg two data analyt techniqu bioinformat industri academia survey concentr review recent research use data mine deep learn approach analyz specif domain knowledg bioinformat author give brief pithi summar numer data mine algorithm use preprocess classif cluster well various optim neural network architectur deep learn method advantag disadvantag practic applic also discuss compar term industri usag believ review paper valuabl insight provid dedic start use data analyt method bioinformat algorithm bay theorem biolog mine machin learn survey questionnair,1
30423142,miRBase: from microRNA sequences to function.,"miRBase catalogs, names and distributes microRNA gene sequences. The latest release of miRBase (v22) contains microRNA sequences from 271 organisms: 38 589 hairpin precursors and 48 860 mature microRNAs. We describe improvements to the database and website to provide more information about the quality of microRNA gene annotations, and the cellular functions of their products. We have collected 1493 small RNA deep sequencing datasets and mapped a total of 5.5 billion reads to microRNA sequences. The read mapping patterns provide strong support for the validity of between 20% and 65% of microRNA annotations in different well-studied animal genomes, and evidence for the removal of >200 sequences from the database. To improve the availability of microRNA functional information, we are disseminating Gene Ontology terms annotated against miRBase sequences. We have also used a text-mining approach to search for microRNA gene names in the full-text of open access articles. Over 500 000 sentences from 18 542 papers contain microRNA names. We score these sentences for functional information and link them with 12 519 microRNA entries. The sentences themselves, and word clouds built from them, provide effective summaries of the functional information about specific microRNAs. miRBase is publicly and freely available at http://mirbase.org/.","Animals *Computational Biology/methods Data Mining *Databases, Nucleic Acid Gene Ontology *Genomics/methods Humans MicroRNAs/*genetics Molecular Sequence Annotation Web Browser","miRBase: from microRNA sequences to function. miRBase catalogs, names and distributes microRNA gene sequences. The latest release of miRBase (v22) contains microRNA sequences from 271 organisms: 38 589 hairpin precursors and 48 860 mature microRNAs. We describe improvements to the database and website to provide more information about the quality of microRNA gene annotations, and the cellular functions of their products. We have collected 1493 small RNA deep sequencing datasets and mapped a total of 5.5 billion reads to microRNA sequences. The read mapping patterns provide strong support for the validity of between 20% and 65% of microRNA annotations in different well-studied animal genomes, and evidence for the removal of >200 sequences from the database. To improve the availability of microRNA functional information, we are disseminating Gene Ontology terms annotated against miRBase sequences. We have also used a text-mining approach to search for microRNA gene names in the full-text of open access articles. Over 500 000 sentences from 18 542 papers contain microRNA names. We score these sentences for functional information and link them with 12 519 microRNA entries. The sentences themselves, and word clouds built from them, provide effective summaries of the functional information about specific microRNAs. miRBase is publicly and freely available at http://mirbase.org/. Animals *Computational Biology/methods Data Mining *Databases, Nucleic Acid Gene Ontology *Genomics/methods Humans MicroRNAs/*genetics Molecular Sequence Annotation Web Browser",microrna sequenc function mirbas catalog name distribut microrna gene sequenc latest releas mirbas contain microrna sequenc hairpin precursor matur microrna describ improv databas websit provid inform qualiti microrna gene annot cellular function product collect small rna deep sequenc dataset map total billion read microrna sequenc read map pattern provid strong support valid microrna annot differ anim genom evid remov sequenc databas improv avail microrna function inform dissemin gene ontolog term annot mirbas sequenc also use approach search microrna gene name open access articl sentenc paper contain microrna name score sentenc function inform link microrna entri sentenc word cloud built provid effect summari function inform specif microrna mirbas public freeli avail mirbas org anim biolog method data mine nucleic acid gene ontolog method human microrna molecular sequenc annot web browser,1
