PMID,Title,Abstract,MH,Test,CleanedText,cluster
28240172,Clinical Applications of Personalized Medicine: A New Paradigm and Challenge.,"The personalized medicine is an emergent and rapidly developing method of clinical practice that uses new technologies to provide decisions in regard to the prediction, prevention, diagnosis and treatment of disease. A continuous evolution of technology and the developments in molecular diagnostics and genomic analysis increased the possibility of an even more understanding and interpretation of the human genome and exome, allowing a ""personalized"" approach to clinical care, so that the concepts of ""Systems Medicine"" and ""System Biology"" are actually increasing. The purpose of this study is to evaluate the personalized medicine about its indications and benefits, actual clinical applications and future perspectives as well as its issues and health care implications. A careful review of the scientific literature on this field that highlighted the applicability and usefulness of this new medical approach as well as the fact that personalized medicine strategy is even more increasing in numerous fields of applications.","Genetic Testing Humans Pathology, Molecular/methods/trends Pharmacogenetics/*methods/trends Practice Patterns, Physicians'/*organization & administration/trends Precision Medicine/*methods/trends","Clinical Applications of Personalized Medicine: A New Paradigm and Challenge. The personalized medicine is an emergent and rapidly developing method of clinical practice that uses new technologies to provide decisions in regard to the prediction, prevention, diagnosis and treatment of disease. A continuous evolution of technology and the developments in molecular diagnostics and genomic analysis increased the possibility of an even more understanding and interpretation of the human genome and exome, allowing a ""personalized"" approach to clinical care, so that the concepts of ""Systems Medicine"" and ""System Biology"" are actually increasing. The purpose of this study is to evaluate the personalized medicine about its indications and benefits, actual clinical applications and future perspectives as well as its issues and health care implications. A careful review of the scientific literature on this field that highlighted the applicability and usefulness of this new medical approach as well as the fact that personalized medicine strategy is even more increasing in numerous fields of applications. Genetic Testing Humans Pathology, Molecular/methods/trends Pharmacogenetics/*methods/trends Practice Patterns, Physicians'/*organization & administration/trends Precision Medicine/*methods/trends",clinic applic person new paradigm challeng person medicin emerg rapid develop method clinic practic use new technolog provid decis regard predict prevent diagnosi treatment diseas continu evolut technolog develop molecular diagnost genom analysi increas possibl even understand interpret human genom exom allow person approach clinic care concept system medicin system biolog actual increas purpos studi evalu person medicin indic benefit actual clinic applic futur perspect well issu health care implic care review scientif literatur field highlight applic use new medic approach well fact person medicin strategi even increas numer field applic genet test human patholog molecular method trend pharmacogenet trend practic pattern physician administr trend precis medicin trend,6
31980301,Enabling Technologies for Personalized and Precision Medicine.,"Individualizing patient treatment is a core objective of the medical field. Reaching this objective has been elusive owing to the complex set of factors contributing to both disease and health; many factors, from genes to proteins, remain unknown in their role in human physiology. Accurately diagnosing, monitoring, and treating disorders requires advances in biomarker discovery, the subsequent development of accurate signatures that correspond with dynamic disease states, as well as therapeutic interventions that can be continuously optimized and modulated for dose and drug selection. This work highlights key breakthroughs in the development of enabling technologies that further the goal of personalized and precision medicine, and remaining challenges that, when addressed, may forge unprecedented capabilities in realizing truly individualized patient care.",Artificial Intelligence/*trends Biomarkers/analysis *Diagnosis Humans Precision Medicine/*trends Therapeutics/*trends,"Enabling Technologies for Personalized and Precision Medicine. Individualizing patient treatment is a core objective of the medical field. Reaching this objective has been elusive owing to the complex set of factors contributing to both disease and health; many factors, from genes to proteins, remain unknown in their role in human physiology. Accurately diagnosing, monitoring, and treating disorders requires advances in biomarker discovery, the subsequent development of accurate signatures that correspond with dynamic disease states, as well as therapeutic interventions that can be continuously optimized and modulated for dose and drug selection. This work highlights key breakthroughs in the development of enabling technologies that further the goal of personalized and precision medicine, and remaining challenges that, when addressed, may forge unprecedented capabilities in realizing truly individualized patient care. Artificial Intelligence/*trends Biomarkers/analysis *Diagnosis Humans Precision Medicine/*trends Therapeutics/*trends",enabl technolog person precis medicin individu patient treatment core object medic field reach object elus owe complex set factor contribut diseas mani factor gene protein remain unknown role human physiolog accur diagnos monitor treat disord requir advanc biomark discoveri subsequ develop accur signatur correspond dynam diseas state well therapeut intervent continu optim modul dose drug select work highlight key breakthrough develop enabl technolog goal person precis medicin remain challeng address may forg unpreced capabl realiz truli individu patient care artifici intellig biomark analysi human precis medicin therapeut,6
30113875,Organoids for Drug Discovery and Personalized Medicine.,"A wide variety of organs are in a dynamic state, continuously undergoing renewal as a result of constant growth and differentiation. Stem cells are required during these dynamic events for continuous tissue maintenance within the organs. In a steady state of production and loss of cells within these tissues, new cells are constantly formed by differentiation from stem cells. Today, organoids derived from either adult stem cells or pluripotent stem cells can be grown to resemble various organs. As they are similar to their original organs, organoids hold great promise for use in medical research and the development of new treatments. Furthermore, they have already been utilized in the clinic, enabling personalized medicine for inflammatory bowel disease. In this review, I provide an update on current organoid technology and summarize the application of organoids in basic research, disease modeling, drug development, personalized treatment, and regenerative medicine.",Animals Drug Discovery/*methods Humans Organoids/*cytology Precision Medicine/*methods Regenerative Medicine/methods,"Organoids for Drug Discovery and Personalized Medicine. A wide variety of organs are in a dynamic state, continuously undergoing renewal as a result of constant growth and differentiation. Stem cells are required during these dynamic events for continuous tissue maintenance within the organs. In a steady state of production and loss of cells within these tissues, new cells are constantly formed by differentiation from stem cells. Today, organoids derived from either adult stem cells or pluripotent stem cells can be grown to resemble various organs. As they are similar to their original organs, organoids hold great promise for use in medical research and the development of new treatments. Furthermore, they have already been utilized in the clinic, enabling personalized medicine for inflammatory bowel disease. In this review, I provide an update on current organoid technology and summarize the application of organoids in basic research, disease modeling, drug development, personalized treatment, and regenerative medicine. Animals Drug Discovery/*methods Humans Organoids/*cytology Precision Medicine/*methods Regenerative Medicine/methods",organoid drug discoveri person medicin wide varieti organ dynam state continu undergo renew result constant growth differenti stem cell requir dynam event continu tissu mainten within organ steadi state product loss cell within tissu new cell constant form differenti stem cell today organoid deriv either adult stem cell pluripot stem cell grown resembl various organ similar origin organ organoid hold great promis use medic research develop new treatment furthermor alreadi util clinic enabl person medicin inflammatori bowel diseas review provid updat current organoid technolog summar applic organoid basic research diseas model drug develop person treatment regen medicin anim drug discoveri human organoid precis medicin regen medicin method,6
29076109,A Review of Food-Drug Interactions on Oral Drug Absorption.,"Food effect, also known as food-drug interactions, is a common phenomenon associated with orally administered medications and can be defined as changes in absorption rate or absorption extent. The mechanisms of food effect and their consequences can involve multiple factors, including human post-prandial physiology, properties of the drug, and how the drug is administered. Therefore, it is essential to have a thorough understanding of these mechanisms when recommending whether a specific drug should be taken with or without food. Food-drug interactions can be clinically relevant, especially when they must be avoided to prevent undesirable effects or exploited to optimize medication therapy. This review conducts a literature search that examined studies on food effect. We summarized the literature and identified and discussed common food effect mechanisms. Furthermore, we highlighted drugs that have a clinically significant food effect and discussed the corresponding mechanisms. In addition, this review analyzes the effects of high-fat food or standard meals on the oral drug absorption rate and absorption extent for 229 drugs based on the Biopharmaceutics Drug Disposition Classification System and demonstrates an association between Biopharmaceutics Drug Disposition Classification System class and food effect.","Administration, Oral Biopharmaceutics Food-Drug Interactions/*physiology *Gastric Absorption Humans *Oral Mucosal Absorption Pharmaceutical Preparations/*metabolism","A Review of Food-Drug Interactions on Oral Drug Absorption. Food effect, also known as food-drug interactions, is a common phenomenon associated with orally administered medications and can be defined as changes in absorption rate or absorption extent. The mechanisms of food effect and their consequences can involve multiple factors, including human post-prandial physiology, properties of the drug, and how the drug is administered. Therefore, it is essential to have a thorough understanding of these mechanisms when recommending whether a specific drug should be taken with or without food. Food-drug interactions can be clinically relevant, especially when they must be avoided to prevent undesirable effects or exploited to optimize medication therapy. This review conducts a literature search that examined studies on food effect. We summarized the literature and identified and discussed common food effect mechanisms. Furthermore, we highlighted drugs that have a clinically significant food effect and discussed the corresponding mechanisms. In addition, this review analyzes the effects of high-fat food or standard meals on the oral drug absorption rate and absorption extent for 229 drugs based on the Biopharmaceutics Drug Disposition Classification System and demonstrates an association between Biopharmaceutics Drug Disposition Classification System class and food effect. Administration, Oral Biopharmaceutics Food-Drug Interactions/*physiology *Gastric Absorption Humans *Oral Mucosal Absorption Pharmaceutical Preparations/*metabolism",review interact oral drug absorpt food effect also known interact common phenomenon associ oral administ medic defin chang absorpt rate absorpt extent mechan food effect consequ involv multipl factor includ human physiolog properti drug drug administ therefor essenti thorough understand mechan recommend whether specif drug taken without food interact clinic relev especi must avoid prevent undesir effect exploit optim medic therapi review conduct literatur search examin studi food effect summar literatur identifi discuss common food effect mechan furthermor highlight drug clinic signific food effect discuss correspond mechan addit review analyz effect food standard meal oral drug absorpt rate absorpt extent drug base biopharmaceut drug disposit classif system demonstr associ biopharmaceut drug disposit classif system class food effect administr oral biopharmaceut interact absorpt human mucos absorpt pharmaceut prepar,0
29703387,Food-drug interactions precipitated by fruit juices other than grapefruit juice: An update review.,"This review addressed drug interactions precipitated by fruit juices other than grapefruit juice based on randomized controlled trials (RCTs). Literature was identified by searching PubMed, Cochrane Library, Scopus and Web of Science till December 30 2017. Among 46 finally included RCTs, six RCTs simply addressed pharmacodynamic interactions and 33 RCTs studied pharmacokinetic interactions, whereas seven RCTs investigated both pharmacokinetic and pharmacodynamic interactions. Twenty-two juice-drug combinations showed potential clinical relevance. The beneficial combinations included orange juice-ferrous fumarate, lemon juice-(99m)Tc-tetrofosmin, pomegranate juice-intravenous iron during hemodialysis, cranberry juice-triple therapy medications for H. pylori, blueberry juice-etanercept, lime juice-antimalarials, and wheat grass juice-chemotherapy. The potential adverse interactions included decreased drug bioavailability (apple juice-fexofenadine, atenolol, aliskiren; orange juice-aliskiren, atenolol, celiprolol, montelukast, fluoroquinolones, alendronate; pomelo juice-sildenafil; grape juice-cyclosporine), increased bioavailability (Seville orange juice-felodipine, pomelo juice-cyclosporine, orange-aluminum containing antacids). Unlike furanocoumarin-rich grapefruit juice which could primarily precipitate drug interactions by strong inhibition of cytochrome P450 3A4 isoenzyme and P-glycoprotein and thus cause deadly outcomes due to co-ingestion with some medications, other fruit juices did not precipitate severely detrimental food-drug interaction despite of sporadic case reports. The extent of a juice-drug interaction may be associated with volume of drinking juice, fruit varieties, type of fruit, time between juice drinking and drug intake, genetic polymorphism in the enzymes or transporters and anthropometric variables. Pharmacists and health professionals should properly screen for and educate patients about potential adverse juice-drug interactions and help minimize their occurrence. Much attention should be paid to adolescents and the elderly who ingest medications with drinking fruit juices or consume fresh fruits during drug treatment. Meanwhile, more researches in this interesting issue should be conducted.",Citrus paradisi/*adverse effects/chemistry Cytochrome P-450 CYP3A/genetics/metabolism *Food-Drug Interactions Fruit and Vegetable Juices/*adverse effects/analysis Humans Randomized Controlled Trials as Topic,"Food-drug interactions precipitated by fruit juices other than grapefruit juice: An update review. This review addressed drug interactions precipitated by fruit juices other than grapefruit juice based on randomized controlled trials (RCTs). Literature was identified by searching PubMed, Cochrane Library, Scopus and Web of Science till December 30 2017. Among 46 finally included RCTs, six RCTs simply addressed pharmacodynamic interactions and 33 RCTs studied pharmacokinetic interactions, whereas seven RCTs investigated both pharmacokinetic and pharmacodynamic interactions. Twenty-two juice-drug combinations showed potential clinical relevance. The beneficial combinations included orange juice-ferrous fumarate, lemon juice-(99m)Tc-tetrofosmin, pomegranate juice-intravenous iron during hemodialysis, cranberry juice-triple therapy medications for H. pylori, blueberry juice-etanercept, lime juice-antimalarials, and wheat grass juice-chemotherapy. The potential adverse interactions included decreased drug bioavailability (apple juice-fexofenadine, atenolol, aliskiren; orange juice-aliskiren, atenolol, celiprolol, montelukast, fluoroquinolones, alendronate; pomelo juice-sildenafil; grape juice-cyclosporine), increased bioavailability (Seville orange juice-felodipine, pomelo juice-cyclosporine, orange-aluminum containing antacids). Unlike furanocoumarin-rich grapefruit juice which could primarily precipitate drug interactions by strong inhibition of cytochrome P450 3A4 isoenzyme and P-glycoprotein and thus cause deadly outcomes due to co-ingestion with some medications, other fruit juices did not precipitate severely detrimental food-drug interaction despite of sporadic case reports. The extent of a juice-drug interaction may be associated with volume of drinking juice, fruit varieties, type of fruit, time between juice drinking and drug intake, genetic polymorphism in the enzymes or transporters and anthropometric variables. Pharmacists and health professionals should properly screen for and educate patients about potential adverse juice-drug interactions and help minimize their occurrence. Much attention should be paid to adolescents and the elderly who ingest medications with drinking fruit juices or consume fresh fruits during drug treatment. Meanwhile, more researches in this interesting issue should be conducted. Citrus paradisi/*adverse effects/chemistry Cytochrome P-450 CYP3A/genetics/metabolism *Food-Drug Interactions Fruit and Vegetable Juices/*adverse effects/analysis Humans Randomized Controlled Trials as Topic",interact precipit fruit juic grapefruit updat review review address drug interact precipit fruit juic grapefruit juic base random control trial rcts literatur identifi search pubm cochran librari scopus web scienc till decemb among final includ rcts six rcts simpli address pharmacodynam interact rcts studi pharmacokinet interact wherea seven rcts investig pharmacokinet pharmacodynam interact combin show potenti clinic relev benefici combin includ orang fumar lemon pomegran iron hemodialysi cranberri therapi medic pylori blueberri lime wheat grass potenti advers interact includ decreas drug bioavail appl atenolol orang atenolol celiprolol montelukast fluoroquinolon pomelo grape increas bioavail sevill orang pomelo contain antacid unlik grapefruit juic could primarili precipit drug interact strong inhibit cytochrom isoenzym thus caus dead outcom due medic fruit juic precipit sever detriment interact despit sporad case report extent interact may associ volum drink juic fruit varieti type fruit time juic drink drug intak genet polymorph enzym transport anthropometr variabl pharmacist health profession proper screen educ patient potenti advers interact help minim occurr much attent paid adolesc elder ingest medic drink fruit juic consum fresh fruit drug treatment meanwhil research interest issu conduct citrus paradisi effect chemistri cytochrom genet metabol interact fruit veget juic effect analysi human random control trial topic,0
28196633,"Old and new oral anticoagulants: Food, herbal medicines and drug interactions.","The most commonly prescribed oral anticoagulants worldwide are the vitamin K antagonists (VKAs) such as warfarin. Factors affecting the pharmacokinetics of VKAs are important because deviations from their narrow therapeutic window can result in bleedings due to over-anticoagulation or thrombosis because of under-anticoagulation. In addition to pharmacodynamic interactions (e.g., augmented bleeding risk for concomitant use of NSAIDs), interactions with drugs, foods, herbs, and over-the-counter medications may affect the risk/benefit ratio of VKAs. Direct oral anticoagulants (DOACs) including Factor Xa inhibitors (rivaroxaban, apixaban and edoxaban) and thrombin inhibitor (dabigatran) are poised to replace warfarin. Phase-3 studies and real-world evaluations have established that the safety profile of DOACs is superior to those of VKAs. However, some pharmacokinetic and pharmacodynamic interactions are expected. Herein we present a critical review of VKAs and DOACs with focus on their potential for interactions with drugs, foods, herbs and over-the-counter medications.","Animals Anticoagulants/chemistry/pharmacokinetics/*pharmacology/therapeutic use *Drug Interactions Food-Drug Interactions Herbal Medicine/methods Humans Plant Extracts/chemistry/pharmacokinetics/*pharmacology/therapeutic use Plants, Medicinal/chemistry Vitamin K/antagonists & inhibitors","Old and new oral anticoagulants: Food, herbal medicines and drug interactions. The most commonly prescribed oral anticoagulants worldwide are the vitamin K antagonists (VKAs) such as warfarin. Factors affecting the pharmacokinetics of VKAs are important because deviations from their narrow therapeutic window can result in bleedings due to over-anticoagulation or thrombosis because of under-anticoagulation. In addition to pharmacodynamic interactions (e.g., augmented bleeding risk for concomitant use of NSAIDs), interactions with drugs, foods, herbs, and over-the-counter medications may affect the risk/benefit ratio of VKAs. Direct oral anticoagulants (DOACs) including Factor Xa inhibitors (rivaroxaban, apixaban and edoxaban) and thrombin inhibitor (dabigatran) are poised to replace warfarin. Phase-3 studies and real-world evaluations have established that the safety profile of DOACs is superior to those of VKAs. However, some pharmacokinetic and pharmacodynamic interactions are expected. Herein we present a critical review of VKAs and DOACs with focus on their potential for interactions with drugs, foods, herbs and over-the-counter medications. Animals Anticoagulants/chemistry/pharmacokinetics/*pharmacology/therapeutic use *Drug Interactions Food-Drug Interactions Herbal Medicine/methods Humans Plant Extracts/chemistry/pharmacokinetics/*pharmacology/therapeutic use Plants, Medicinal/chemistry Vitamin K/antagonists & inhibitors",old new oral food herbal medicin drug interact common prescrib oral anticoagul worldwid vitamin antagonist vkas warfarin factor affect pharmacokinet vkas import deviat narrow therapeut window result bleed due thrombosi addit pharmacodynam interact augment bleed risk concomit use nsaid interact drug food herb medic may affect risk benefit ratio vkas direct oral anticoagul doac includ factor inhibitor rivaroxaban apixaban edoxaban thrombin inhibitor dabigatran pois replac warfarin studi evalu establish safeti profil doac superior vkas howev pharmacokinet pharmacodynam interact expect herein present critic review vkas doac focus potenti interact drug food herb medic anim anticoagul chemistri pharmacokinet therapeut use interact interact herbal medicin method human plant extract chemistri pharmacokinet therapeut use plant medicin chemistri vitamin antagonist inhibitor,0
